[
  {
    "id": "CLM-KDX-001",
    "class": "OBSERVED",
    "statement": "KODEX−∞ has a dedicated public canonical repository with an active draft bootstrap pull request.",
    "sourceIds": ["SRC-KDX-CANON-REPO"],
    "variables": ["repository", "pull_request_state"],
    "unit": null,
    "denominator": null,
    "timeScope": "2026-08-05",
    "geographyScope": null,
    "populationScope": null,
    "method": "Direct repository inspection",
    "formula": null,
    "uncertainty": "Repository state may change after the recorded access date.",
    "contradictions": [],
    "limitations": ["The draft is not merged into main."],
    "publicationStatus": "ADMITTED",
    "attribution": "KODEX repository record"
  },
  {
    "id": "CLM-KDX-002",
    "class": "OBSERVED",
    "statement": "The existing KODEX implementation uses Astro and contains a fullscreen/deck entry route on the verified feature branch.",
    "sourceIds": ["SRC-WENU-KODEX-INDEX"],
    "variables": ["framework", "route_structure"],
    "unit": null,
    "denominator": null,
    "timeScope": "Repository state at access on 2026-08-05",
    "geographyScope": null,
    "populationScope": null,
    "method": "Direct file inspection at a recorded Git blob SHA",
    "formula": null,
    "uncertainty": "Other branches may contain additional or newer implementations.",
    "contradictions": [],
    "limitations": ["No production-browser validation was performed during ingestion."],
    "publicationStatus": "ADMITTED",
    "attribution": "wenu-frontend implementation record"
  },
  {
    "id": "CLM-KDX-003",
    "class": "OBSERVED",
    "statement": "The verified visual grammar maps KODEX scenes to data-driven recipes, grids, motion presets and field parameters.",
    "sourceIds": ["SRC-WENU-GRAMMAR"],
    "variables": ["scene_recipe", "grid", "motion", "field_parameters"],
    "unit": null,
    "denominator": null,
    "timeScope": "Repository state at access on 2026-08-05",
    "geographyScope": null,
    "populationScope": null,
    "method": "Direct TypeScript source inspection",
    "formula": null,
    "uncertainty": "Recipe JSON dependencies require separate full inventory.",
    "contradictions": [],
    "limitations": ["The older grammar predates the current semantic-passport standard."],
    "publicationStatus": "ADMITTED",
    "attribution": "wenu-frontend visual grammar"
  },
  {
    "id": "CLM-KDX-004",
    "class": "OBSERVED",
    "statement": "The Threshold Portal specification defines a multipass source, feedback and composite pipeline with DORMANT, AWARE and OPEN states.",
    "sourceIds": ["SRC-WENU-THRESHOLD-SPEC"],
    "variables": ["render_pass", "scene_state"],
    "unit": null,
    "denominator": null,
    "timeScope": "Repository state at access on 2026-08-05",
    "geographyScope": null,
    "populationScope": null,
    "method": "Direct specification inspection",
    "formula": null,
    "uncertainty": "The specification's described integration state must be reverified against current code.",
    "contradictions": [],
    "limitations": [],
    "publicationStatus": "ADMITTED",
    "attribution": "Threshold Portal specification"
  },
  {
    "id": "CLM-KDX-005",
    "class": "OBSERVED",
    "statement": "The recovered transparent helix archive contains three source files and has the recorded SHA-256 checksum.",
    "sourceIds": ["SRC-KDX-HELIX-ARCHIVE"],
    "variables": ["archive_file_count", "archive_sha256"],
    "unit": "files",
    "denominator": null,
    "timeScope": "Direct inspection on 2026-08-05",
    "geographyScope": null,
    "populationScope": null,
    "method": "ZIP central-directory and byte checksum inspection",
    "formula": null,
    "uncertainty": null,
    "contradictions": [],
    "limitations": ["Archive inspection does not prove browser compatibility on every target device."],
    "publicationStatus": "ADMITTED",
    "attribution": "KODEX package inspection"
  },
  {
    "id": "CLM-KDX-006",
    "class": "OBSERVED",
    "statement": "The directly inspected Impossible Forms sellable archive contains 77 files and the Python source path KODEX_Impossible_Forms_Vol1/source/python/kodex_forms.py.",
    "sourceIds": ["SRC-KDX-IMPOSSIBLE-FORMS-ARCHIVE"],
    "variables": ["archive_file_count", "python_source_path", "archive_sha256"],
    "unit": "files",
    "denominator": null,
    "timeScope": "Direct inspection on 2026-08-05",
    "geographyScope": null,
    "populationScope": null,
    "method": "ZIP central-directory and byte checksum inspection",
    "formula": null,
    "uncertainty": null,
    "contradictions": ["An earlier recovered summary named reference_renderer.py; context/ERRATA.md supersedes that summary for the inspected archive."],
    "limitations": ["The commercial package remains outside the public repository and is not yet runtime-validated or licensed for release."],
    "publicationStatus": "REVIEW",
    "attribution": "KODEX package inspection"
  },
  {
    "id": "CLM-KDX-007",
    "class": "INTERPRETATION",
    "statement": "KODEX evolved from a collection of visual concepts toward a shared living-information system with explicit evidence, memory, module and convergence rules.",
    "sourceIds": [
      "SRC-KDX-CANON-REPO",
      "SRC-WENU-KODEX-INDEX",
      "SRC-WENU-UNIVERSE",
      "SRC-WENU-GRAMMAR",
      "SRC-WENU-THRESHOLD-SPEC",
      "SRC-KDX-HELIX-ARCHIVE"
    ],
    "variables": ["system_evolution"],
    "unit": null,
    "denominator": null,
    "timeScope": "Recovered development lineage through 2026-08-05",
    "geographyScope": null,
    "populationScope": null,
    "method": "KODEX editorial synthesis of verified repository and package records",
    "formula": null,
    "uncertainty": "The lineage is incomplete until every package and branch is inventoried.",
    "contradictions": [],
    "limitations": ["This is an attributed KODEX interpretation, not an independently validated historical conclusion."],
    "publicationStatus": "ADMITTED",
    "attribution": "KODEX−∞ editorial interpretation"
  }
]
